{"contract_version":"hermes-context.v1","freshness":"live","gateway":{"heartbeat_at":"2026-09-24T10:03:00.000Z","offline_after_seconds":45},"generated_at":"2026-09-24T10:03:00.000Z","profile":"gamma","sessions":[{"context":{"maximum":200000,"measured_at":"2026-09-24T10:02:30.000Z","percentage":45.0,"source":"provider_reported","used":90000},"current_tool":"terminal","discord_route":{"channel_id":"channel-10","channel_label":"#ops","guild_id":"guild-1","thread_id":"thread-4"},"display_name":"Refactor docs","lineage_root_id":"gamma-3","model":"model-h","platform":"discord","previous_session_id":null,"profile":"gamma","provider":"provider-g","routing_id":"hc1:0b9f9ab3542488b77ab60a1c6018b548d115b7ca857555ec32667d14011dd495","session_id":"gamma-3","state":"working","timing":{"last_activity_at":"2026-09-24T10:03:00.000Z","turn_started_at":"2026-09-24T10:02:00.000Z"}},{"context":{"maximum":null,"measured_at":null,"percentage":null,"source":null,"used":null},"current_tool":null,"discord_route":{"channel_id":"channel-10","channel_label":"#ops","guild_id":"guild-1","thread_id":"thread-5"},"display_name":"Scratch notes","lineage_root_id":"gamma-4","model":"model-g","platform":"discord","previous_session_id":null,"profile":"gamma","provider":"provider-g","routing_id":"hc1:3054fdf5513beea15303ec6bf32a0f7eb88fb7fcf4a54ba2216b7ac0f54b3d4d","session_id":"gamma-4","state":"idle","timing":{"last_activity_at":"2026-09-23T10:31:00.000Z","turn_started_at":null}},{"context":{"maximum":null,"measured_at":null,"percentage":null,"source":null,"used":null},"current_tool":null,"discord_route":{"channel_id":"channel-20","channel_label":"#planning","guild_id":"guild-1","thread_id":null},"display_name":"Weekly planning","lineage_root_id":"gamma-1","model":"model-g","platform":"discord","previous_session_id":null,"profile":"gamma","provider":"provider-g","routing_id":"hc1:68a06c90e5a6dabb8bf452db2974454318a381e57ce7fc3875aba1807b7f223a","session_id":"gamma-1","state":"idle","timing":{"last_activity_at":"2026-09-22T08:05:00.000Z","turn_started_at":null}},{"context":{"maximum":200000,"measured_at":"2026-09-24T09:49:30.000Z","percentage":22.5,"source":"provider_reported","used":45000},"current_tool":null,"discord_route":{"channel_id":"channel-10","channel_label":"#ops","guild_id":"guild-1","thread_id":"thread-3"},"display_name":"Deploy review","lineage_root_id":"gamma-2","model":"model-g","platform":"discord","previous_session_id":null,"profile":"gamma","provider":"provider-g","routing_id":"hc1:8f0932327fe0f5f4b6a8863ddf1d5a378a5335431353ed15e22b992645e8a757","session_id":"gamma-2","state":"needs_attention","timing":{"last_activity_at":"2026-09-24T09:50:00.000Z","turn_started_at":"2026-09-24T09:49:00.000Z"}}]}
