{"contract_version":"hermes-context.v1","freshness":"live","gateway":{"heartbeat_at":"2026-09-24T10:01:00.000Z","offline_after_seconds":45},"generated_at":"2026-09-24T10:01:00.000Z","profile":"alpha","sessions":[{"context":{"maximum":1000,"measured_at":"2026-09-24T10:00:30.000Z","percentage":30.0,"source":"provider_reported","used":300},"current_tool":null,"discord_route":{"channel_id":"channel-10","channel_label":"#ops","guild_id":"guild-1","thread_id":"thread-1"},"display_name":"First thread","lineage_root_id":"alpha-1","model":"model-a","platform":"discord","previous_session_id":null,"profile":"alpha","provider":"provider-a","routing_id":"hc1:160ee740bb71d08c1aaf998afb7d22730c97e91d45a4c1a43943cd3885ba16ea","session_id":"alpha-1","state":"working","timing":{"last_activity_at":"2026-09-24T10:00:30.000Z","turn_started_at":"2026-09-24T10:00:00.000Z"}},{"context":{"maximum":null,"measured_at":null,"percentage":null,"source":null,"used":null},"current_tool":null,"discord_route":{"channel_id":"channel-10","channel_label":"#ops","guild_id":"guild-1","thread_id":"thread-2"},"display_name":"Second thread","lineage_root_id":"alpha-2","model":"model-a","platform":"discord","previous_session_id":null,"profile":"alpha","provider":"provider-a","routing_id":"hc1:e3182a6ae8ca759c1c8b966d2bfdda8eb806f911438158cbdc01a76ed86f1507","session_id":"alpha-2","state":"working","timing":{"last_activity_at":"2026-09-24T10:01:00.000Z","turn_started_at":"2026-09-24T10:01:00.000Z"}}]}
