{"contract_version":"hermes-context.v1","freshness":"live","gateway":{"heartbeat_at":"2026-09-24T10:05:00.000Z","offline_after_seconds":45},"generated_at":"2026-09-24T10:05:00.000Z","profile":"beta","sessions":[{"context":{"maximum":null,"measured_at":null,"percentage":null,"source":null,"used":null},"current_tool":null,"discord_route":{"channel_id":"channel-10","channel_label":"#ops","guild_id":"guild-1","thread_id":"thread-1"},"display_name":"First thread","lineage_root_id":"beta-1","model":"model-b","platform":"discord","previous_session_id":null,"profile":"beta","provider":"provider-b","routing_id":"hc1:ef4ea13bbe35e92edc6cf6b6e1a5f268c2a1dbc4c8ec741bd7c9e959c733390a","session_id":"beta-1","state":"idle","timing":{"last_activity_at":"2026-09-24T10:05:00.000Z","turn_started_at":null}}]}
